Id,Question,Gen.contains(Man),Comment
369,When the production of Side Door ended?,true,Ok
370,When the production of Sister Ella ended?,true,Ok
371,When the production of Sitting Nude ended?,true,Ok
372,When the production of Six Copper Photo-Plates ended?,null,Incorrect Stanza Parsing
373,When the production of Sky Totem ended?,true,Ok
374,When the production of Small Gull Sleeping ended?,true,Ok
375,"When the production of Small Town, Main Street ended?",null,Incorrect partial DRS
376,When the production of Smithsonian Castle ended?,true,Ok
377,When the production of Snow Clearance ended?,true,Ok
378,When the production of Snowballs ended?,true,Ok
379,When the production of Sonar ended?,true,Ok
380,When the production of Sophia ended?,true,Ok
381,When the production of Sorrows of Departure ended?,null,Incorrect partial DRS
382,When the production of South of Lincoln Square ended?,null,Incorrect partial DRS
383,"When the production of Sphinx, Thames, London ended?",null,Incorrect partial DRS
384,When the production of Spice Tower ended?,true,Ok
385,When the production of Split Encounter ended?,true,Ok
386,When the production of Sprinter ended?,true,Ok
387,When the production of St. Valery-Blow-Wild Thyme ended?,null,Incorrect Stanza Parsing
388,When the production of Standing Articulated Figure ended?,true,Ok
389,When the production of Standing Artist ended?,true,Ok
390,When the production of Startled Mallard ended?,true,Ok
391,When the production of Stepping into Shoes ended?,null,Incorrect partial DRS
392,When the production of Still Life with Fan and Roses ended?,null,Incorrect partial DRS
393,When the production of Still Life with Pineapple ended?,null,Incorrect partial DRS
394,"When the production of Street Crowds, Tunisia ended?",null,Incorrect partial DRS
395,When the production of Street in Joliet ended?,null,Incorrect partial DRS
396,When the production of Striped Bass ended?,true,Ok
397,When the production of Strong Left Hand ended?,true,Ok
398,When the production of Structure ended?,true,Ok
399,When the production of Study for Baits ended?,null,Incorrect partial DRS
400,When the production of Study for the Disciple Peter ended?,null,Incorrect partial DRS
401,When the production of Study in Auburn ended?,null,Incorrect partial DRS
402,When the production of Summer Horizon ended?,true,Ok
403,When the production of Sun Flowers ended?,true,Ok
404,When the production of Sunlight ended?,true,Ok
405,When the production of Sunny Slopes ended?,true,Ok
406,When the production of Sunside Stock & Poultry Farm ended?,null,Incorrect Stanza Parsing
407,When the production of Surrational Zeus ended?,true,Ok
408,When the production of Suzanna ended?,true,Ok
409,When the production of Swedish Lady ended?,true,Ok
410,When the production of Synagogue ended?,true,Ok
411,When the production of THE FREEDOM STOMPERS ended?,true,Ok
412,When the production of Teacher Benares ended?,true,Ok
413,When the production of Tetuan ended?,true,Ok
414,When the production of Texas Cavalry Medal (obverse) ended?,null,Incorrect Stanza Parsing
415,When the production of The Beauty Parlor ended?,true,Ok
416,When the production of The Birdlover ended?,true,Ok
417,When the production of The Black Hat ended?,true,Ok
418,When the production of The Bottle ended?,true,Ok
419,When the production of The Brothers ended?,true,Ok
420,When the production of The Cat ended?,true,Ok
421,When the production of The Committee ended?,true,Ok
422,When the production of The Corner Butcher ended?,true,Ok
423,When the production of The Enchanted Pool ended?,true,Ok
424,When the production of The Fruit Wagon ended?,true,Ok
425,When the production of The Gilded Age ended?,true,Ok
426,When the production of The Good Luck Branch ended?,true,Ok
427,When the production of The Grind-Stone ended?,null,Incorrect Stanza Parsing
428,When the production of The Indian Ghost Dancer ended?,true,Ok
429,When the production of The Isabelle ended?,true,Ok
430,When the production of The Joseph Henry Medal ended?,true,Ok
431,When the production of The Lobster Fisherman ended?,true,Ok
432,"When the production of The Mangrove Coast, Florida ended?",null,Incorrect partial DRS
433,When the production of The Mink Trapper ended?,true,Ok
434,When the production of The Phantom ended?,true,Ok
435,When the production of The Presses ended?,true,Ok
436,When the production of The Race ended?,true,Ok
437,When the production of The Restaurant ended?,true,Ok
438,When the production of The Rough Camp ended?,true,Ok
439,When the production of The Shaded Walk ended?,true,Ok
440,When the production of The Star Barber Shop ended?,null,Incorrect Stanza Parsing
441,When the production of The Sun in Sung Time ended?,null,Incorrect partial DRS
442,When the production of The Things That Are Caesar's ended?,null,Incorrect Stanza Parsing
443,When the production of The Three Chickens ended?,true,Ok
444,When the production of The True Mother Goose ended?,true,Ok
445,When the production of The Two-Step ended?,null,Incorrect Stanza Parsing
446,When the production of The Young Sabot Maker ended?,true,Ok
447,When the production of Third and Rhode Island ended?,null,Incorrect partial DRS
448,When the production of This is the Enemy ended?,null,Incorrect Stanza Parsing
449,When the production of Thomas Hopkinson ended?,true,Ok
450,When the production of Tibet ended?,true,Ok
451,When the production of Tide Rip ended?,true,Ok
452,When the production of Tongue River Cliffs (In Camp) ended?,null,Incorrect partial DRS
453,When the production of Totem ended?,true,Ok
454,"When the production of Tower at Enkhuisen, Holland ended?",null,Incorrect Stanza Parsing
455,When the production of Town Wharf ended?,true,Ok
456,When the production of Toy Bicycle Rider ended?,null,Incorrect Stanza Parsing
457,"When the production of Traders, Gallup, N.M. ended?",null,Incorrect partial DRS
458,When the production of Trapeze Girl ended?,true,Ok
459,When the production of Trees Against the Night Sky ended?,null,Incorrect partial DRS
460,When the production of Triggered ended?,null,Incorrect partial DRS
461,When the production of Tropic Moon ended?,true,Ok
462,When the production of Tur ended?,true,Ok
463,When the production of Twilight after the Rain ended?,null,Incorrect Stanza Parsing
464,When the production of Two Beds ended?,true,Ok
465,When the production of Two Bottles ended?,true,Ok
466,When the production of Two Cedars ended?,true,Ok
467,When the production of Two Magnolias ended?,true,Ok
468,When the production of Two Men Pushing Cart ended?,null,Incorrect partial DRS
469,When the production of Two Sisters with Doll ended?,null,Incorrect partial DRS
470,When the production of Undaunted (Torso) ended?,true,Ok
471,When the production of Under Flowers ended?,null,Incorrect Stanza Parsing
472,"When the production of Upper Falls, Yellowstone ended?",null,Incorrect partial DRS
473,When the production of Urban Self-Projection ended?,null,Incorrect Stanza Parsing
474,When the production of Valley of the Swiftcurrent ended?,null,Incorrect partial DRS
475,When the production of Veronica wormskjoldii ended?,true,Ok
476,When the production of Veronica's Veil ended?,null,Incorrect Stanza Parsing
477,When the production of Vertical Bridge ended?,true,Ok
478,When the production of Vertical Roll ended?,true,Ok
479,When the production of Veterans ended?,true,Ok
480,When the production of Victory Overseas ended?,true,Ok
481,When the production of Victory Wreath ended?,true,Ok
482,When the production of Virga ended?,true,Ok
483,When the production of Vorahnung (Premonition) ended?,true,Ok
484,When the production of Wall of Light Blue ended?,null,Incorrect partial DRS
485,When the production of Ward Heelers ended?,true,Ok
486,When the production of Wayfarers ended?,true,Ok
487,When the production of Wealth ended?,true,Ok
488,When the production of West Neck Beach (Two Figures) ended?,null,Incorrect Stanza Parsing
489,When the production of White Tanks ended?,true,Ok
490,When the production of White man on wagon ended?,null,Incorrect partial DRS
491,When the production of Wild Flowers ended?,true,Ok
492,When the production of William Thaw ended?,true,Ok
493,"When the production of Wine Cart, Paris ended?",null,Incorrect partial DRS
494,When the production of Winter Bluebirds ended?,true,Ok
495,When the production of Winter Skating in New Jersey ended?,null,Incorrect partial DRS
496,When the production of Woman Washing Clothes ended?,null,Incorrect Stanza Parsing
497,When the production of Woman in a Yellow Vest ended?,null,Incorrect partial DRS
498,When the production of World Trade Center ended?,null,Incorrect Stanza Parsing
499,When the production of Young Michelangelo ended?,true,Ok
500,When the production of Zurich ended?,true,Ok
